x,y,biome,description
0,0,"Residential","Front yard of a single-family home, featuring a small flower bed with colorful petunias and a white picket fence. A bicycle leans against the gate, and a wind chime rings softly in the breeze."
0,1,"Residential","Sidewalk lined with neat hedges and a stone path leading to the front door of a charming two-story house. A couple of garden gnomes peek out from the bushes, while a tabby cat lounges lazily on the porch steps."
0,2,"Residential","Driveway of a single-family home, with a parked sedan and a basketball hoop mounted on the garage. A few scattered leaves swirl in the wind, and the sound of children playing can be heard from nearby."
0,3,"Residential","Backyard of a single-family home, filled with a wooden swing set and a small vegetable garden brimming with zucchini and peppers. The scent of freshly cut grass fills the air, and a dog barks playfully in the distance."
0,4,"Residential","Narrow pathway leading to the entrance of another single-family home, adorned with climbing ivy and decorative lanterns. A colorful welcome mat sits at the door, and a sprinkler system quietly waters the lawn."
0,5,"Residential","Front porch of a cozy house, complete with a rocking chair and potted plants. A newspaper lies on the welcome mat, and the faint sound of a guitar can be heard from inside the house."
0,6,"Commercial","Outdoor seating area of a small café, with wrought-iron tables and chairs under colorful umbrellas. The aroma of freshly brewed coffee wafts through the air, while customers chat or work on laptops with pastries in front of them."
0,7,"Commercial","Display windows of a boutique shop, showcasing vibrant clothing and accessories. A small chalkboard sign outside lists the daily specials, and a friendly shopkeeper waves at passersby."
0,8,"Commercial","Entrance to a small bookstore, with a wooden door partly open and a welcome bell jingling. Stacks of books are displayed on the sidewalk, and a cozy reading nook is visible through the window."
0,9,"Commercial","Corner of the street where a food truck serves tacos, with a line of eager customers waiting. Colorful decorations hang from the truck, and the sound of lively music adds to the vibrant atmosphere."
1,0,"Residential","Paved driveway leading up to a freshly painted bungalow, with a small porch adorned by potted herbs. The sound of laughter from a nearby backyard echoes softly."
1,1,"Residential","Neatly trimmed lawn of a single-family home, with a children's swing set and a colorful jungle gym. A few kids are playing tag, creating bursts of joyful laughter."
1,2,"Residential","Side of a single-family home with a chain-link fence, where climbing roses add a splash of color. A small dog barks from the backyard, and a squirrel scampers up a nearby tree."
1,3,"Residential","Front entry of a craftsman-style home, with a wooden porch swing and a decorative wreath on the door. The lawn is dotted with dandelions, and bees buzz around the flowering plants."
1,4,"Residential","Backyard enclosed by a tall fence, featuring a small koi pond and a wooden deck with lounge chairs. The soft sound of water trickling adds to the serene environment."
1,5,"Residential","Front garden of a charming home, filled with lavender and marigolds, creating a pleasant aroma. A small fountain trickles gently, attracting birds that chirp nearby."
1,6,"Commercial","Cozy interior of a café with vintage decor, where patrons sip coffee and chat. The barista is busy preparing drinks behind a counter lined with baked goods."
1,7,"Commercial","Outdoor display of a flower shop, with vibrant bouquets arranged for passersby. The sweet fragrance of fresh blooms fills the air, alongside the sounds of light chatter."
1,8,"Commercial","Entrance to a small thrift store, with a colorful sign hanging above. An assortment of second-hand items is visible through the window, enticing customers to browse."
1,9,"Commercial","Front of a boutique, where a mannequin displays the latest fashion. A friendly staff member stands outside, ready to greet potential shoppers with a warm smile."
2,0,"Residential","Well-kept front yard of a single-family home, featuring a white swing and a lush green lawn. A small stone path leads to the entrance, bordered by colorful flower beds."
2,1,"Residential","Side garden of a home with sunflowers swaying in the breeze and a small picnic table. The sound of birds chirping fills the air, complementing the serene ambiance."
2,2,"Residential","Driveway leading to a garage, with a well-maintained car parked under a shaded tree. A few garden tools are leaned against the side of the house."
2,3,"Residential","Backyard enclosed by a wooden fence, featuring a small vegetable patch and a hammock tied between two trees. The scent of ripe tomatoes wafts in the air."
2,4,"Residential","Pathway leading to the entrance of a home, accentuated by hanging flower baskets and a small water feature that creates a soothing sound."
2,5,"Residential","Front yard of a single-family home, where colorful flowerbeds burst with zinnias and petunias. A wooden bench sits in the shade of a cherry tree, inviting neighbors to pause and chat."
2,6,"Commercial","Facade of a quirky bookstore, its windows adorned with hand-painted signs announcing the latest reads. A small chalkboard outside displays special offers, while the scent of fresh coffee wafts from within."
2,7,"Commercial","Sidewalk cafe area with mismatched tables and chairs, where a couple enjoys pastries under bright umbrellas. The sound of clinking cups mingles with upbeat music spilling from inside the café."
2,8,"Commercial","Entrance to a vintage clothing shop, with a colorful assortment of retro garments displayed on racks. A large, inviting sign hangs above, and a friendly shopkeeper waves to passing pedestrians."
2,9,"Commercial","Front of a trendy juice bar, where vibrant fruits are displayed in a glass case. The air is filled with the sweet and tangy scent of fresh juice being blended, and a chalkboard lists the daily specials."
3,0,"Residential","Neatly trimmed hedge borders the front yard, showcasing a collection of potted herbs beside a stone path leading to the entrance. A small dog barks playfully from the porch."
3,1,"Residential","Charming front porch adorned with hanging ferns and a welcome mat. A wooden rocking chair creaks gently in the breeze, while the sound of children laughing echoes from nearby yards."
3,2,"Residential","Backyard visible over a low fence, where kids play on a swing set. Lush grass and a small sandbox invite laughter and joy, as a friendly cat lounges in the sun."
3,3,"Residential","Pathway leading to a cozy front door, flanked by large flower pots filled with cheerful daisies. The soft sound of wind chimes tinkles from above the entrance."
3,4,"Residential","Grassy lawn bordered by a low picket fence, where a small garden of marigolds adds vibrant color. A wooden swing hangs from a tree branch, swaying gently in the afternoon breeze."
3,5,"Residential","Patio area with string lights overhead, creating a warm ambiance for evening gatherings. A fire pit is surrounded by Adirondack chairs, inviting friends to gather for s'mores."
3,6,"Commercial","Vibrant mural on the side of a cafe, depicting a whimsical cityscape. Tables spill onto the sidewalk, with patrons enjoying the sunny day, laughter echoing as they sip their drinks."
3,7,"Commercial","Outdoor seating area of a popular eatery, with colorful planters lining the edge. The delicious aroma of grilled food wafts through the air, drawing in hungry customers."
3,8,"Commercial","Display window of a bakery showing off a variety of pastries and cakes. The sugary scent of freshly baked goods fills the street, while a small bell jingles as customers enter."
3,9,"Commercial","Front of a boutique shop, with a mannequin showcasing the latest seasonal fashion. A friendly shop assistant stands by the entrance, greeting shoppers with a smile and a warm welcome."
4,0,"Residential","Welcoming front porch with a wicker chair and a small table holding a potted plant. A decorative wind spinner twirls gently, creating playful shadows on the ground."
4,1,"Residential","Lush front garden filled with lilacs and daisies, creating a colorful border around the yard. A small bird feeder hangs from a tree, attracting chirping sparrows."
4,2,"Residential","Driveway leading to a garage, where bicycles are neatly parked. A patch of clover peeks through the cracks in the pavement, adding a touch of nature to the urban setting."
4,3,"Residential","Tree-shaded backyard with a small wooden deck, where a barbecue grill sits ready for summer cookouts. A quaint hammock hangs lazily, inviting relaxation."
4,4,"Residential","Pathway lined with solar lights guiding the way to the back entrance, while a small birdbath attracts various feathered friends. The sound of rustling leaves fills the air."
4,5,"Residential","Backyard filled with a patch of wildflowers, creating a mini wildlife haven. A small wooden gate opens to the alley, revealing glimpses of passing neighbors."
4,6,"Commercial","Outdoor display of a popular ice cream shop with colorful flavors showcased in a glass case. The cheerful chatter of children and families enjoying treats fills the atmosphere."
4,7,"Commercial","Cafe entrance with a large awning, providing shade for outdoor diners. Potted herbs line the railing, enhancing the aroma of fresh dishes being served."
4,8,"Commercial","Front of a small grocery store, with fresh produce displayed outside. The vibrant colors of fruits and vegetables create an inviting atmosphere, drawing in local shoppers."
4,9,"Commercial","Entrance to a trendy bar, where a few patrons mingle outside on high stools. The sound of laughter and clinking glasses creates a lively ambiance in the evening air."
5,0,"Residential","Charming front yard with a low white picket fence, adorned with climbing roses that spill over the top. A small wooden bench sits beneath a shady maple tree, offering a peaceful spot to enjoy the morning sun."
5,1,"Residential","Neatly manicured lawn with a vibrant assortment of annual flowers blooming along the walkway. A wind chime hangs from the porch, creating a soothing melody as it dances in the gentle breeze."
5,2,"Residential","Front of a cozy home with a stone pathway leading to the door. A decorative lantern illuminates the entryway, while a small herb garden thrives in planters by the steps."
5,3,"Residential","Backyard with a well-used swing set under a large oak tree, where children’s laughter often fills the air. A wooden fence provides privacy, and colorful kites can sometimes be seen flying above."
5,4,"Residential","Endearing front porch with a rocking chair and hanging ferns. A small welcome mat lays at the entrance, and a cat can often be spotted lounging on the steps, soaking up the sun."
5,5,"Park","Pathway meandering through a vibrant park, with sun-dappled light filtering through the leaves of nearby trees. Benches line the path, inviting visitors to rest while enjoying the sights and sounds of nature."
5,6,"Commercial","Front of a quaint bookstore with large windows displaying a selection of new releases. An inviting chalkboard sign outside advertises a book club meeting, and the faint scent of fresh coffee wafts from a nearby café."
5,7,"Commercial","Small bakery with the aroma of freshly baked bread wafting through the air. A display case filled with pastries tempts passersby, while a few tables are placed outside for enjoying warm treats."
5,8,"Commercial","Outdoor seating area of a trendy café, adorned with colorful cushions and small tables. A chalkboard lists daily specials, and the chatter of patrons blends with the sound of clinking coffee mugs."
5,9,"Commercial","Vibrant entrance to a local craft shop, with handmade signs and art displayed in the window. The sound of laughter spills out as children participate in a craft workshop inside."
7,5,"Park","A sunlit section of the park featuring a well-maintained grassy patch, dotted with people playing frisbee and children flying kites. A sturdy wooden bench sits invitingly under a cluster of leafy trees, offering a perfect spot for relaxation and enjoying the vibrant atmosphere."
7,6,"Commercial","The outdoor seating area of a bustling café, with colorful umbrellas providing shade over small tables. Patrons sip their coffees while engaging in animated conversations, and the sound of laughter fills the air as a barista calls out orders."
7,7,"Commercial","Front of a small vintage shop, with an eclectic array of items displayed in the window, including retro toys and antique furniture. A bell jingles softly as customers enter, and the shopkeeper greets them with a warm smile."
7,8,"Commercial","An artisanal ice cream stand, with a vibrant menu board showcasing a variety of unique flavors. Customers line up eagerly as the sweet scent of waffle cones fills the air, and children can be seen enjoying their treats at nearby tables."
7,9,"Commercial","The entrance of a charming flower shop, with vibrant blooms spilling out onto the sidewalk. A display of potted plants and fresh bouquets catches the eye, and the gentle chime of a doorbell signals the arrival of new customers."
8,5,"Park","A peaceful walking path lined with blooming shrubs and wildflowers, winding through the park. The sound of birds chirping fills the air, and a small group of joggers pass by, taking in the beauty of their surroundings."
8,6,"Commercial","The storefront of a cozy café, with large glass windows showcasing delectable pastries and freshly brewed coffee. A chalkboard sign outside announces the daily specials, and the warm smell of baked goods wafts into the street."
8,7,"Commercial","A trendy boutique with stylish clothing displayed in the window. Shoppers browse through racks of colorful garments while a friendly staff member assists customers, creating a lively atmosphere."
8,8,"Commercial","A local gym’s entrance, with bold banners promoting fitness classes. The sound of weights clanking and upbeat music spills outside, while enthusiastic members enter and exit, showcasing the community's commitment to health."
8,9,"Commercial","The front of a small bookshop, with a cozy reading nook visible through the windows. The smell of coffee and old books combines enticingly, inviting passersby to step inside and explore the literary treasures within."
9,5,"Park","A small playground filled with cheerful children playing on swings and slides. Brightly colored equipment stands out against the backdrop of green grass, while parents relax on benches, keeping a watchful eye on the fun."
9,6,"Commercial","The facade of a bustling deli, with an enticing array of sandwiches and salads displayed in the window. The sounds of slicing and laughter from the staff can be heard, suggesting a warm, community-focused atmosphere."
9,7,"Commercial","A quaint thrift store with an inviting sign and a treasure trove of second-hand goods visible through the windows. People browse through clothes and knick-knacks, engaging in friendly conversations about hidden gems."
9,8,"Commercial","A small pet shop with a vibrant display of fish tanks and small animals visible from outside. The sounds of playful puppies can be heard, and children stop to watch them, captivated by their antics."
9,9,"Commercial","The entrance of a popular café with outdoor seating, where the aroma of roasted coffee beans mingles with freshly baked pastries. Customers enjoy their drinks under string lights, creating a cozy evening atmosphere."